Sheet: BOM
B2: Project : | C2: GCM | F2: V5.1
B4: Author : Guillaume Guillet | E4: Revision 1 | F4: Licensed under CERN-OHL-W v2 or later
A6: Type | B6: Value | C6: Q | D6: References | E6: Package | F6: Manufacturer | G6: Store | H6: Store ID | I6: Unit price* | J6: Price
A7: C | B7: 10nF | C7: 33 | D7: C1, C6 to C8, C12, C13, C16 to C24, C28 to C32, C35 to C41, C49, C50, C52 to C55 | E7: C_0805_2012Metric | F7: KEMET | G7: Mouser | H7: 80-C0805C103J5R | I7: 0.033 | J7: of:=[.I7]*[.C7] -> 1.089
B8: 100nF | C8: 20 | D8: C3 to C5, C9 to C11, C14, C15, C25 to C27, C33, C34, C42 to C48 | E8: C_0805_2012Metric | F8: KEMET | G8: Mouser | H8: 80-C0805C104M3R | I8: 0.032 | J8: of:=[.I8]*[.C8] -> 0.64
B9: 1uF | C9: 4 | D9: C2, C51, C56, C57 | E9: C_0805_2012Metric | F9: KEMET | G9: Mouser | H9: 80-C0805C105K3R7210 | I9: 0.132 | J9: of:=[.I9]*[.C9] -> 0.528
A10: X1 | B10: ECS-2200BX-500 | C10: 1 | D10: X1 | E10: Oscillator_DIP-8 | F10: ECS | G10: Mouser | H10: 520-2200BX-500 | I10: 2.92 | J10: of:=[.I10]*[.C10] -> 2.92
A11: U | B11: 74AHC273 | C11: 6 | D11: U4, U32, U40, U42 to U44 | E11: SOIC-20W_7.5x12.8mm_Pitch1.27mm | F11: Texas Instruments | G11: Mouser | H11: 595-SN74AHC273DWR | I11: 0.403 | J11: of:=[.I11]*[.C11] -> 2.418
B12: LM810 | C12: 1 | D12: U1 | E12: SOT-23-3 | F12: Texas Instruments | G12: Mouser | H12: 926-LM810M3463NOPB | I12: 0.696 | J12: of:=[.I12]*[.C12] -> 0.696
B13: LTC6994-1 | C13: 1 | D13: U2 | E13: SOT-23-6 | F13: Analog Devices | G13: Mouser | H13: 584-C6994IS6-1TRMPBF | I13: 3.65 | J13: of:=[.I13]*[.C13] -> 3.65
B14: CD74AC161M | C14: 6 | D14: U13, U14, U16, U17, U19, U20 | E14: SOP-16_3.9x9.9mm_P1.27mm | F14: Texas Instruments | G14: Mouser | H14: 595-CD74AC161M | I14: 0.751 | J14: of:=[.I14]*[.C14] -> 4.506
B15: CD74AC151 | C15: 6 | D15: U28, U29, U31, U35 to U37 | E15: SOP-16_3.9x9.9mm_P1.27mm | F15: Texas Instruments | G15: Mouser | H15: 595-CD74AC151M96 | I15: 0.823 | J15: of:=[.I15]*[.C15] -> 4.938
B16: SN74LV393A | C16: 4 | D16: U26, U27, U33, U34 | E16: SOIC-14_3.9x8.7mm_P1.27mm | F16: Texas Instruments | G16: Mouser | H16: 595-SN74LV393ADR | I16: 0.796 | J16: of:=[.I16]*[.C16] -> 3.184
B17: CD74AC238 | C17: 1 | D17: U6 | E17: SOP-16_3.9x9.9mm_P1.27mm | F17: Texas Instruments | G17: Mouser | H17: 595-CD74AC238M96 | I17: 0.549 | J17: of:=[.I17]*[.C17] -> 0.549
B18: 74AHC244 | C18: 3 | D18: U8, U9, U12 | E18: SOIC-20W_7.5x12.8mm_Pitch1.27mm | F18: Texas Instruments | G18: Mouser | H18: 595-SN74AHC244DWR | I18: 0.448 | J18: of:=[.I18]*[.C18] -> 1.344
B19: 74AHCT244 | C19: 1 | D19: U21 | E19: SOIC-20W_7.5x12.8mm_Pitch1.27mm | F19: Texas Instruments | G19: Mouser | H19: 595-SN74AHCT244DWR | I19: 0.448 | J19: of:=[.I19]*[.C19] -> 0.448
B20: 74AHC138 | C20: 1 | D20: U7 | E20: SOIC-16W_5.3x10.2mm_P1.27mm | F20: Texas Instruments | G20: Mouser | H20: 595-SN74AHC138NSR | I20: 0.494 | J20: of:=[.I20]*[.C20] -> 0.494
B21: 74AHC1G04 | C21: 4 | D21: U5, U11, U18, U41 | E21: SOT-23-5 | F21: Texas Instruments | G21: Mouser | H21: 595-SN74AHC1G04DBVR | I21: 0.266 | J21: of:=[.I21]*[.C21] -> 1.064
B22: 74AHCT1G04 | C22: 1 | D22: U15 | E22: SOT-23-5 | F22: Texas Instruments | G22: Mouser | H22: 595-SN74AHCT1G04DBVR | I22: 0.311 | J22: of:=[.I22]*[.C22] -> 0.311
B23: 74AHC1G32 | C23: 3 | D23: U3, U25, U30 | E23: SOT-23-5 | F23: Texas Instruments | G23: Mouser | H23: 595-SN74AHC1G32DBVR | I23: 0.266 | J23: of:=[.I23]*[.C23] -> 0.798
B24: 74LVC1G74 | C24: 1 | D24: U10 | E24: SM-8 | F24: Texas Instruments | G24: Mouser | H24: 595-SN74LVC1G74DCTR | I24: 0.604 | J24: of:=[.I24]*[.C24] -> 0.604
B25: 74CBTLV16212 | C25: 3 | D25: U22 to U24 | E25: TSSOP-56 | F25: Texas Instruments | G25: Mouser | H25: 595-SN74CBTLV16212GR | I25: 2.03 | J25: of:=[.I25]*[.C25] -> 6.09
A26: R | B26: 523k | C26: 1 | D26: R1 | E26: R_0805_2012Metric | F26: Panasonic | G26: Mouser | H26: 667-ERJ-PB6D5233V | I26: 0.256 | J26: of:=[.I26]*[.C26] -> 0.256
B27: 1M | C27: 1 | D27: R2 | E27: R_0805_2012Metric | F27: Panasonic | G27: Mouser | H27: 667-ERJ-6RED1004V | I27: 0.192 | J27: of:=[.I27]*[.C27] -> 0.192
B28: 305k | C28: 1 | D28: R3 | E28: R_0805_2012Metric | F28: Panasonic | G28: Mouser | H28: 667-ERA-6AED3093V | I28: 0.229 | J28: of:=[.I28]*[.C28] -> 0.229
B29: 10k | C29: 3 | D29: R4 to R6 | E29: R_0805_2012Metric | F29: Yageo | G29: Mouser | H29: 603-RT0805FRE0710KL | I29: 0.11 | J29: of:=[.I29]*[.C29] -> 0.33
A30: RN | B30: 8x10k | C30: 3 | D30: RN1 to RN3 | E30: R_Array_SIP9 | F30: Bourns | G30: Mouser | H30: 652-4609X-1LF-10K | I30: 0.247 | J30: of:=[.I30]*[.C30] -> 0.741
A31: J | B31: TE_Eurocard_96pole | C31: 1 | D31: J6 | E31: Eurocard_5650473-5 Receptacle | F31: TE connectivity | G31: Mouser | H31: 571-5650461-5 | I31: 5.38 | J31: of:=[.I31]*[.C31] -> 5.38
B32: Nano-Fit power connectors | C32: 1 | D32: J1 | E32: Molex_1053102116 | F32: Molex | G32: Mouser | H32: 538-105310-1108 | I32: 1.6 | J32: of:=[.I32]*[.C32] -> 1.6
B33: 5530843-2 | C33: 2 | D33: J8, J11 | E33: TE_5530843-2 | F33: TE connectivity | G33: Mouser | H33: 571-5530843-2 | I33: 2.33 | J33: of:=[.I33]*[.C33] -> 4.66
B34: 5-5530843-4 | C34: 4 | D34: J2 to J5 | E34: 5-5530843-4 | F34: TE connectivity | G34: Mouser | H34: 571-5-5530843-4 | I34: 2.84 | J34: of:=[.I34]*[.C34] -> 11.36
B35: 3-641124-6 | C35: 1 | D35: J7 | E35: 3-641124-6 | F35: TE connectivity | G35: Mouser | H35: 571-3-641124-6 | I35: 1.36 | J35: of:=[.I35]*[.C35] -> 1.36
B36: Header10p | C36: 2 | D36: J10, J13 | E36: Header_10p_2.54 | F36: Wurth Electronics | G36: Mouser | H36: 710-61201021621 | I36: 0.411 | J36: of:=[.I36]*[.C36] -> 0.822
B37: Conn_01x02_Male | C37: 1 | D37: J9 | E37: PinHeader_1x02_P2.54mm_Vertical | F37: TE connectivity | G37: Mouser | H37: 571-1037412 | I37: 0.234 | J37: of:=[.I37]*[.C37] -> 0.234
B38: Conn_02x21_Male | C38: 1 | D38: J12 | E38: PinHeader_2x21_P2.54mm_Vertical | F38: TE connectivity | G38: Mouser | H38: 571-9-146258-0 | I38: 3.22 | J38: of:=[.I38]*[.C38] -> 3.22
A39: - | B39: PCB_GCM_V5.x | C39: 1 | D39: - | E39: - | F39: G.Guillet | G39: - | J39: of:=[.I39]*[.C39] -> 0
H41: Total price : | J41: of:=SUM([.J7:.J39]) -> 66.655
H42: *Depend of the quantity | I42: Price is in CHF